NodeName,DocumentUrlPath,NodeAliasPath,DocumentPageTitle,DocumentPageDescription,recommend
บริษัทลูกอมอายุ 100 ปีในญี่ปุ่น ปรับตัวอย่างไร เพื่อให้เข้ากับเทรนด์สุขภาพที่เปลี่ยนแปลงไปแล้ว,/plearn-plearn/healthy-trend-sugar-japan,/plearn-plearn/business/marketing/healthy-trend-sugar-japan,บริษัทลูกอมอายุ 100 ปีในญี่ปุ่น ปรับตัวอย่างไร เพื่อให้เข้ากับเทรนด์สุขภาพที่เปลี่ยนแปลงไปแล้ว,เมื่อบริษัทลูกอมญี่ปุ่นที่มีอายุกว่า 100 ปี ต้องปรับตัวกับเทรนด์สุขภาพที่หันมางดการบริโภคน้ำตาล อะไรคือเคล็ดลับที่ทำให้บริษัทนี้มียอดขายท่ามกลางเทรนด์ที่เปลี่ยนไป มาดูกัน,"[658, 374, 529, 256, 667, 60, 126, 686, 161, 281, 21, 1253, 549, 187, 186, 338, 536, 295, 235, 417]"
ไอเดียเปลี่ยนบ้านทาส ให้เป็นบ้านแมว | เรื่องชีวิตคิดให้ง่าย EP.19,/plearn-plearn/home-decor-for-cat-lover,/plearn-plearn/podcast/simple-life-tip/home-decor-for-cat-lover,ไอเดียเปลี่ยนบ้านทาส ให้เป็นบ้านแมว | เรื่องชีวิตคิดให้ง่าย EP.19,ไอเดียแต่งบ้านเพื่อเจ้าเหมียวตามสไตล์ทาสแมว ไอเดียว่าควรจัดสรรพื้นที่ในบ้านเราอย่างไรดี ให้บ้านเป็นสัดส่วน ต้นไม้ประดับที่เหมาะกับน้องแมว,"[404, 146, 206, 840, 180, 1222, 1528, 1640, 847, 1284, 787, 798, 1563, 1585, 757, 1433, 298, 676, 751, 112]"
เปิดเทอมใหม่นี้ วัยรุ่นต้องเตรียมความพร้อมอะไรบ้าง?,/plearn-plearn/prepare-before-back-to-school,/plearn-plearn/lifestyle/living/prepare-before-back-to-school,เปิดเทอมใหม่นี้ วัยรุ่นต้องเตรียมความพร้อมอะไรบ้าง?,เปิดเทอมใหม่นี้อาจมีลุ้นได้กลับไปเรียนตามปกติกันสักที จะได้ไปใช้ชีวิตนักศึกษาแบบจัดเต็ม งั้นเรามาเตรียมความพร้อมรับเปิดเทอมกันดีกว่า,"[760, 242, 353, 567, 578, 1125, 403, 99, 501, 279, 739, 1020, 374, 84, 832, 538, 175, 64, 286, 319]"
4 วิธีช่วยสร้างความสัมพันธ์ที่ดีให้คนในองค์กร,/plearn-plearn/4-way-building-relationship-work,/plearn-plearn/business/management/4-way-building-relationship-work,4 วิธีช่วยสร้างความสัมพันธ์ที่ดีให้คนในองค์กร,เคยแปลกใจไหม? ทำไมองค์กรเราคนลาออกไม่เว้นวัน..1 ในสาเหตุที่หลายคนเจอคือ “เราไม่รู้สึกเป็นส่วนหนึ่งในองค์กร” แล้วเราจะแก้อย่างไรกันดี เรามี 4 เคล็ดลลับดีๆ ที่จะช่วยฟื้นฟูความสัมพันธ์ดีๆ ของคนในองค์กรให้กลับมาเหมือนเก่า,"[326, 1161, 473, 1639, 62, 13, 851, 249, 212, 295, 162, 1001, 1450, 444, 168, 41, 170, 1650, 128, 1012]"
การลงทุนทางเลือก เลือกลงทุนที่ชอบ | เรื่องเงินย่อยง่าย EP 19,/plearn-plearn/alternative-assets-investment,/plearn-plearn/podcast/simple-money-tip/alternative-assets-investment,การลงทุนทางเลือก เลือกลงทุนที่ชอบ | เรื่องเงินย่อยง่าย EP 19,การลงทุนทางเลือก - Alternative Assets หรือ การลงทุนในสินทรัพย์อื่นใดที่ไม่ใช่สินทรัพย์หลัก เริ่มต้นจากที่สิ่งที่ชอบมาเป็นการลงทุนได้มั้ย ถือเป็นการกระจายความเสี่ยงได้หรือไม่ และข้อควรระวังก่อนเริ่มลงทุน,"[1632, 356, 368, 1377, 426, 300, 1652, 25, 296, 1165, 1054, 752, 1010, 1206, 589, 1374, 623, 297, 612, 694]"
อยากเป็นแม่ค้าของเกาหลี เริ่มธุรกิจแบบไหนให้มีกำไร,/plearn-plearn/korea-product-online-shopping,/plearn-plearn/business/marketing/korea-product-online-shopping,อยากเป็นแม่ค้าของเกาหลี เริ่มธุรกิจแบบไหนให้มีกำไร,กระแสซีรีส์เกาหลีกำลังฮิต! อย่าปล่อยให้กระแสผ่านไปเฉยๆ มาจับโอกาสเปิดธุรกิจขายสินค้าเกาหลีกันดีกว่า แต่จะนำสินค้าอะไรเข้ามาขาย? เรามีตัวอย่างสินค้ามาแนะนำ รับรองขายดีแบบเพลินๆ,"[371, 18, 222, 1367, 520, 551, 691, 126, 1233, 335, 743, 1363, 406, 156, 1647, 259, 330, 52, 913, 21]"
ไอเทมสายมู ที่ของมันต้องมี! ถ้าไม่อยากพลาดเรื่องดีๆ ในชีวิต,/plearn-plearn/4-goodluck-items-2022,/plearn-plearn/lifestyle/living/4-goodluck-items-2022,ไอเทมสายมู ที่ของมันต้องมี! ถ้าไม่อยากพลาดเรื่องดีๆ ในชีวิต,ช่วงนี้ดวงไม่ค่อยดีเลย ไม่ว่าทำอะไรก็บ้งไปหมดทุกเรื่อง อย่าเพิ่งเศร้ามารับไอเทมสายมูไปบูชากันดีไหม แล้วชีวิตจะดีขึ้นแบบไม่รู้ตัว จะมีไอเทมสายมูชิ้นไหนน่าสนใจ มาดูเลย!,"[157, 183, 560, 142, 127, 262, 56, 360, 919, 24, 1651, 353, 190, 158, 64, 43, 1354, 455, 50, 62]"
สงกรานต์นี้เที่ยวไหนดี ถึงไม่เปียกก็สนุกได้!,/plearn-plearn/songkran-planning-trip-with-family,/plearn-plearn/lifestyle/eat-travel/songkran-planning-trip-with-family,สงกรานต์นี้เที่ยวไหนดี ถึงไม่เปียกก็สนุกได้!,หยุดยาวช่วงสงกรานต์นี้ไปเที่ยวไหนดี? ไม่อยากเปียก แต่อยากให้หัวใจนุ่มฟู เราขอเป็นไกด์ช่วยแพลนทริปสงกรานต์ให้เอง จะมีที่สถานที่ท่องเที่ยวไหนน่าสนใจบ้าง เก็บกระเป๋าแล้วตามเราไปได้เลย!,"[595, 587, 353, 455, 471, 262, 552, 808, 1462, 1409, 560, 905, 127, 279, 315, 380, 451, 574, 759, 309]"
“ปี 2022 ไลฟ์สไตล์คนญี่ปุ่นจะเปลี่ยนแปลงอย่างไรบ้าง”,/plearn-plearn/trend-lifestyle-japanese-2022,/plearn-plearn/lifestyle/living/trend-lifestyle-japanese-2022,“ปี 2022 ไลฟ์สไตล์คนญี่ปุ่นจะเปลี่ยนแปลงอย่างไรบ้าง”,ปี 2022 ที่ญี่ปุ่นจะมีเรื่องเป็นเทรนด์อยู่บ้าง สำหรับใครที่คิดถึงประเทศญี่ปุ่น มาอัพเดทไลฟ์สไตล์คนญี่ปุ่นตอนนี้กันหน่อย อ่านเลย!,"[27, 510, 16, 364, 131, 658, 262, 295, 269, 343, 381, 13, 1637, 21, 42, 259, 529, 349, 1532, 835]"
PSVM : เหงามั้ย? มาแอบฟังเสียงจากคนแปลกหน้ารอบโลกกัน!,/plearn-plearn/invite-listen-post-secret-voicemail,/plearn-plearn/lifestyle/living/invite-listen-post-secret-voicemail,PSVM : เหงามั้ย? มาแอบฟังเสียงจากคนแปลกหน้ารอบโลกกัน!,คุณไม่ได้เหงาอยู่คนเดียว..บนโลกใบนี้ ยังมีคนรู้สึกแบบนี้อีกมากทั่วโลก มาคลายความเหงาในใจด้วยการแอบฟังเสียงจากคนแปลกหน้าจากทั่วโลกด้วย Post Secret Voicemail มาบอกลาความเหงาไปด้วย ที่นี่เลย!,"[1034, 72, 273, 802, 749, 1254, 64, 42, 550, 32, 268, 86, 197, 47, 352, 954, 512, 254, 161, 327]"
เช็กดวง 12 ราศี ชุดใหญ่ หลัง 2 ดาวใหญ่ย้ายราศี พร้อมเคล็ดลับเสริมดวงปัง,/plearn-plearn/lunar-eclipse-horoscope,/plearn-plearn/lifestyle/living/lunar-eclipse-horoscope,เช็กดวง 12 ราศี ชุดใหญ่ หลัง 2 ดาวใหญ่ย้ายราศี พร้อมเคล็ดลับเสริมดวงปัง,เช็กดวง 12 ราศี หลังราหู และดาวพฤหัสย้าย โดยหมอไก่ พ.พาทินี ดวงการงาน การเงิน ความรัก จะเป็นอย่างไร คลิกเลย,"[23, 39, 12, 57, 53, 150, 240, 76, 193, 117, 176, 225, 100, 211, 133, 258, 271, 285, 385, 629]"
เปลี่ยนรถทั้งทีรถ EV คุ้มมั้ยในยุคน้ำมันแพง | เรื่องชีวิตคิดให้ง่าย EP.18,/plearn-plearn/choose-electric-car,/plearn-plearn/podcast/simple-life-tip/choose-electric-car,เปลี่ยนรถทั้งทีรถ EV คุ้มมั้ยในยุคน้ำมันแพง | เรื่องชีวิตคิดให้ง่าย EP.18,"มีคำตอบในทุกข้อสงสัยเรื่องรถยนต์ไฟฟ้า รถยนต์ไฟฟ้าเหมาะสำหรับคนขับรถที่มีไลฟ์สไตล์แบบไหนมาแลกเปลี่ยนความเห็นกันในหัวข้อ ""เปลี่ยนรถทั้งทีรถ EV คุ้มมั้ยในยุคน้ำมันแพง""","[69, 823, 1029, 880, 447, 585, 1044, 1319, 541, 1023, 696, 269, 559, 834, 1086, 903, 1310, 564, 1032, 220]"
เช็กดวงชะตา 12 ราศี เดือนเมษายน 2565 โดย หมอไก่ พ.พาทินี,/plearn-plearn/apr-2022-horoscope,/plearn-plearn/lifestyle/living/apr-2022-horoscope,เช็กดวงชะตา 12 ราศี เดือนเมษายน 2565 โดย หมอไก่ พ.พาทินี,เช็กดวง 12 ราศี เดือนเมษายน ปี 2565 โดยหมอไก่ พ.พาทินี ดวงการงาน การเงิน ความรัก จะเป็นอย่างไร คลิกเลย,"[23, 39, 57, 53, 225, 10, 150, 240, 117, 193, 76, 100, 176, 211, 133, 790, 435, 258, 271, 285]"
3 เรื่องที่ผู้นำควรโฟกัสในปี 2022,/plearn-plearn/3-things-leadership-focus,/plearn-plearn/business/management/3-things-leadership-focus,3 เรื่องที่ผู้นำควรโฟกัสในปี 2022,ผู้นำองค์กรยุคนี้ต้องโฟกัสให้ถูกจุด ถึงจะพาพนักงานไปถึงฝันที่ตั้งใจไว้ได้! มาดูกันว่าปี 2022 จะมีเรื่องไหนที่ผู้นำองค์กรต้องสนใจบ้าง พบคำตอบได้ในบทความนี้เลย,"[83, 326, 1161, 1231, 8, 264, 912, 52, 3, 803, 121, 34, 994, 1450, 455, 62, 97, 353, 16, 130]"
ส่องธุรกิจตู้อัตโนมัติ แฟรนไชส์ไหนน่าลงทุนบ้าง,/plearn-plearn/franchise-vending-machine,/plearn-plearn/business/marketing/franchise-vending-machine,ส่องธุรกิจตู้อัตโนมัติ แฟรนไชส์ไหนน่าลงทุนบ้าง,ตู้อัตโนมัติกำลังมาแรง อยากเปิดธุรกิจแนวนี้จะดีไหม? อยากลงทุนธุรกิจแฟรนไชส์ตู้อัตโนมัติจะเลือกแบรนด์ไหนดี บทความนี้มีคำตอบให้คุณ!,"[261, 360, 65, 144, 52, 307, 1634, 61, 214, 182, 232, 32, 197, 553, 126, 306, 406, 64, 460, 161]"
โรคระบาดก็เอาไม่อยู่ พลัง Kpop ช่วยฟื้นเศรษฐกิจชาติ,/plearn-plearn/key-success-kpop-culture,/plearn-plearn/lifestyle/living/key-success-kpop-culture,โรคระบาดก็เอาไม่อยู่ พลัง Kpop ช่วยฟื้นเศรษฐกิจชาติ,แฟนด้อม Kpop ต้องห้ามพลาด! มาดูกันว่าอะไรคือกุญแจความสำเร็จที่ทำให้วัฒนธรรม Kpop ครองในแฟนคลับไปทั่วโลก มารู้เรื่อง Kpop ให้มากขึ้นที่นี่เลย,"[72, 276, 549, 1623, 56, 256, 187, 163, 769, 144, 9, 1358, 1405, 1432, 692, 984, 161, 326, 127, 115]"
ส่องเทรนด์นวัตกรรม พลิกโลกจากงาน CES 2022,/plearn-plearn/trend-technology-innovation-2022,/plearn-plearn/innovation/innovation-sub/trend-technology-innovation-2022,ส่องเทรนด์นวัตกรรม พลิกโลกจากงาน CES 2022,นวัตกรรมแบบนี้สิมาแรงในปี 2022 ส่องเทคโนโลยีใหม่ ๆจากงาน CES 2022 เมื่อต้นปี จะมีนวัตกรรมไหนช่วยพลิกโฉมชีวิตของเราให้ดีขึ้นบ้าง ไม่อยากตกเทรนด์ ห้ามพลาดเลยนะ,"[586, 8, 42, 825, 40, 295, 841, 963, 1315, 13, 568, 467, 144, 658, 110, 267, 103, 235, 232, 1317]"
ดอกเบี้ยขาขึ้น บริหารหนี้อย่างไรดี | เรื่องเงินย่อยง่าย EP 18,/plearn-plearn/debt-management-inflation,/plearn-plearn/podcast/simple-money-tip/debt-management-inflation,ดอกเบี้ยขาขึ้น บริหารหนี้อย่างไรดี | เรื่องเงินย่อยง่าย EP 18,"คุยกับ โค้ชหนุ่ม-จักรพงษ์ เมษพันธุ์ เจ้าของเพจ Money Coach ในหัวข้อ ""ดอกเบี้ยขาขึ้น บริหารหนี้อย่างไรดี"" ถึงเรื่องการบริหารหนี้ ทั้งหนี้บัตรเครดิต ผ่อนรถ ผ่อนบ้าน ในภาวะที่ดอกเบี้ยเป็นขาขึ้นแบบนี้ จะมีวิธีบริหารจัดการอย่างไร","[328, 181, 725, 726, 470, 1283, 206, 1311, 798, 1044, 572, 189, 88, 1383, 1271, 720, 559, 688, 621, 1083]"
เศรษฐกิจยังไม่ฟื้นตัว ขายของออนไลน์อะไรดี? ถึงได้กำไร,/plearn-plearn/online-selling-after-covid19,/plearn-plearn/business/marketing/online-selling-after-covid19,เศรษฐกิจยังไม่ฟื้นตัว ขายของออนไลน์อะไรดี? ถึงได้กำไร,เริ่มต้นปีนี้ จะขายของออนไลน์อะไรดี? ให้มีกำไรแบบยั่งยืน พ่อค้าแม่ค้าคนไหนอยากเริ่มต้นวงการนี้ เรามีไอเดียสินค้าน่าขายมาฝาก อ่านตรงนี้เลย!,"[161, 371, 124, 691, 52, 606, 5, 144, 335, 187, 126, 1233, 467, 46, 234, 1651, 24, 21, 295, 446]"
กฎหมายจราจรที่ไม่ควรมองข้าม ถ้าอยากเป็นนักขับที่ดี,/plearn-plearn/traffic-rules,/plearn-plearn/lifestyle/living/traffic-rules,กฎหมายจราจรที่ไม่ควรมองข้าม ถ้าอยากเป็นนักขับที่ดี,ไม่มีใครอยากให้เกิดอุบ้ติเหตุบนท้องถนน..มารู้จักกฎหมายจราจรที่ควรรู้ ถ้าไม่อยากผิดมีโทษอย่าทำแบบนี้นะ อ่านต่อได้ในบทความนี้เลย!,"[1045, 158, 144, 1008, 467, 451, 52, 884, 181, 1409, 1541, 111, 1526, 1500, 18, 106, 725, 1645, 161, 349]"
ในอนาคตเราอาจสามารถรับบทเป็นนักจิตวิทยารักษาตัวเองผ่าน VR!,/plearn-plearn/roleplay-psychologist-vr,/plearn-plearn/lifestyle/living/roleplay-psychologist-vr,ในอนาคตเราอาจสามารถรับบทเป็นนักจิตวิทยารักษาตัวเองผ่าน VR!,จะดีแค่ไหนถ้าวันหนึ่งเราสามารถบำบัดจิตตัวเองได้ ผ่านแว่น VR มารู้จักแอปพลิเคชันดีๆ ที่ทำให้การฟื้นฟูจิตใจเป็นเรื่องง่าย ที่ไม่ว่าใครก็สวมบทเป็นคุณจิตวิทยาด้วยตัวเอง,"[282, 1511, 229, 62, 1117, 987, 235, 1426, 144, 642, 175, 993, 1150, 1633, 1394, 74, 156, 170, 506, 56]"
“ขายออนไลน์แล้วขายดีเวอร์” ตัวอย่างไอเดียธุรกิจในญี่ปุ่นที่เอาชนะโควิด-19,/plearn-plearn/ideas-japan-online-business,/plearn-plearn/business/marketing/ideas-japan-online-business,“ขายออนไลน์แล้วขายดีเวอร์” ตัวอย่างไอเดียธุรกิจในญี่ปุ่นที่เอาชนะโควิด-19,หลายคนบอกว่าการมาของโควิด-19 ทำให้ธุรกิจซบเซา แต่ญี่ปุ่นในปีที่ผ่านมากลับมียอดขายทางออนไลน์สูงมากๆ อะไรคือจุดเปลี่ยนของธุรกิจในญี่ปุ่น เราหาคำตอบไปด้วยกันเลย,"[126, 371, 381, 161, 364, 330, 691, 295, 52, 406, 307, 814, 242, 27, 1053, 310, 417, 8, 1409, 313]"
เบื่อแล้วสเตตัสโสด หารักออนไลน์ยังไงให้เวิร์ค? | เรื่องชีวิตคิดให้ง่าย EP.17,/plearn-plearn/application-online-dating,/plearn-plearn/podcast/simple-life-tip/application-online-dating,เบื่อแล้วสเตตัสโสด หารักออนไลน์ยังไงให้เวิร์ค? | เรื่องชีวิตคิดให้ง่าย EP.17,Appหาคู่ โอกาสของการเจอรักของคนยุคนี้แล้วจะหาคู่ออนไลน์อย่างไรให้เวิร์คและกลายเป็นคู่ในชีวิตจริงได้  มาฟังเทคนิคจาก ผศ.ดร.วิลาสินี พนานครทรัพย์  ผู้เชียวชาญเรื่องความสัมพันธ์,"[250, 230, 562, 221, 1640, 664, 770, 1456, 1024, 429, 109, 662, 124, 371, 318, 85, 276, 1013, 529, 1432]"
เช็กดวงชะตา 12 ราศี เดือนมีนาคม 2565 โดย หมอไก่ พ.พาทินี,/plearn-plearn/mar-2022-horoscope,/plearn-plearn/lifestyle/living/mar-2022-horoscope,เช็กดวงชะตา 12 ราศี เดือนมีนาคม 2565 โดย หมอไก่ พ.พาทินี,เช็กดวง 12 ราศี เดือน มีนาคม ปี 2565 โดยหมอไก่ พ.พาทินี ดวงการงาน การเงิน ความรัก จะเป็นอย่างไร คลิกเลย,"[39, 12, 57, 53, 240, 10, 150, 117, 193, 76, 225, 176, 100, 211, 133, 801, 594, 607, 449, 258]"
ไปให้รุ่งตั้งแต่ต้นปี ด้วยแผน (ไม่ลับ) ช่วยวางแผนการเงิน,/plearn-plearn/start-year-planning-money-bonus,/plearn-plearn/guru-financial/money-tips/start-year-planning-money-bonus,ไปให้รุ่งตั้งแต่ต้นปี ด้วยแผน (ไม่ลับ) ช่วยวางแผนการเงิน,โบนัสปีนี้ออกแล้ว!! จะวางแผนการเงินยังไงดี? ให้เงินก้อนนี้มีประสิทธิภาพที่สุด ไม่ต้องคิดเหนื่อย เรามีไอเดียดีๆ มาฝาก ไปวางแผนการเงินกันเลย,"[127, 1441, 755, 1555, 1636, 731, 1009, 137, 511, 1346, 1553, 390, 1077, 848, 629, 829, 474, 617, 664, 285]"
ชวนดู...โอกาสลงทุนในกอง REIT,/plearn-plearn/invest-reits-trust,/plearn-plearn/guru-financial/investment/invest-reits-trust,ชวนดู...โอกาสลงทุนในกอง REIT,นอกจากการลงทุนในหุ้น หรือคริปโตฯ การลงทุนในกองทุนรวมอสังหา หรือ REIT ที่มีความเสี่ยงน้อย แต่ได้เงินปันผลสม่ำเสมอ ก็เป็นอีกตัวเลือกที่น่าสนใจ,"[1632, 139, 702, 1012, 4, 589, 964, 991, 1648, 1063, 128, 1558, 166, 300, 1206, 460, 32, 306, 1377, 1010]"
"""Stay Interview"" รักษาพนักงานอย่างไร เมื่อเจอกับ The Great Resignation",/plearn-plearn/stay-interview,/plearn-plearn/business/management/stay-interview,"""Stay Interview"" รักษาพนักงานอย่างไร เมื่อเจอกับ The Great Resignation",กระแสการลาออกจากงาน ในช่วงโควิด มีแนวโน้มเพิ่มสูงมากขึ้นจนน่าสนใจ อะไรคือสาเหตุที่แม้แต่วิวฤตโรคระบาด ก็รั้งไว้ไม่อยู่ และรู้จักวิธี Stay Interview ที่จะมาหยุดปัญหานี้เหล่านี้ให้หมดไป,"[164, 232, 34, 50, 43, 1500, 1354, 41, 967, 139, 156, 1251, 364, 789, 159, 1650, 564, 511, 649, 315]"
