NodeName,DocumentUrlPath,NodeAliasPath,DocumentPageTitle,DocumentPageDescription,recommend
เที่ยวนานา-ซอกแซกหาเยาวราช: ความเก่าที่กลายเป็นความคูล,/plearn-plearn/เทยวนานา-เยาวราช-ยานเกา-กรงเทพ,/plearn-plearn/lifestyle/eat-travel/เทยวนานา-เยาวราช-ยานเกา-กรงเทพ,เที่ยวนานา-ซอกแซกหาเยาวราช: ความเก่าที่กลายเป็นความคูล,สัมผัสอีกมุมของกรุงเทพกับเสน่ห์ย่านเก่า “นานา เยาวราช” เมื่อความคลาสสิกในอดีตถูกส่งต่อจากรุ่นสู่รุ่นจนกลายเป็นความโมเดิร์นที่วินเทจ,"[843, 155, 697, 444, 303, 977, 715, 429, 979, 1464, 660, 576, 243, 1335, 384, 667, 190, 1624, 601, 96]"
ลูกน้อยติดเกม ทำยังไงดี: วิธีรับมือลูกติดเกมอย่างสร้างสรรค์,/plearn-plearn/วธ-รบมอ-ลกตดเกม-อยางสรางสรรค,/plearn-plearn/lifestyle/living/วธ-รบมอ-ลกตดเกม-อยางสรางสรรค,ลูกติดเกม ทำยังไงดี: วิธีรับมือลูกติดเกมอย่างสร้างสรรค์,อาการเด็กติดเกมจึงเริ่มกลายเป็นปัญหาใหญ่สำหรับพ่อแม่ การช่วยเหลือลูกน้อยด้วยการควบคุมพฤติกรรมการเล่นเกมออนไลน์จึงเป็นเรื่องที่พ่อแม่ควรใส่ใจ,"[673, 768, 1421, 99, 605, 1552, 723, 1344, 149, 439, 1205, 446, 1505, 839, 719, 1347, 287, 405, 1213, 155]"
"""ของมันต้องมี"" ทำไมสปอร์ตแฟชั่นถึงกำลังมา",/plearn-plearn/ธรกจ-สปอรตแฟชน-ทำไม-มาแรง,/plearn-plearn/business/marketing/ธรกจ-สปอรตแฟชน-ทำไม-มาแรง,"""ของมันต้องมี"" ทำไมสปอร์ตแฟชั่นถึงกำลังมา",เมื่อแฟชั่น เทรนด์การออกกำลังกาย และสื่อโซเชียลมีเดียมารวมกัน จึงเกิดเป็นกระแส  สปอร์ตแฟชั่น  สุดฮิตทั้งในและต่างประเทศ,"[472, 962, 658, 86, 1141, 588, 264, 519, 1647, 1589, 1553, 256, 73, 742, 1039, 1651, 24, 5, 1519, 222]"
ทิศทางของฟินเทคสตาร์ทอัพในไทย,/plearn-plearn/ทศทาง-ฟนเทค-สตารทอพ-ไทย,/plearn-plearn/business/management/ทศทาง-ฟนเทค-สตารทอพ-ไทย,ทิศทางของฟินเทคสตาร์ทอัพในไทย | Plearn เพลิน,ทิศทางของฟินเทคสตาร์ทอัพในไทยจะเติบโตหรือไม่ขึ้นอยู่กับการสนับสนุนจากภาคส่วนต่าง ๆ รวมทั้งแหล่งเงินทุนจาก VC เช่น กรุงศรีฟินโนเวต,"[880, 1262, 1278, 187, 370, 1135, 392, 1007, 280, 875, 876, 171, 1055, 565, 356, 717, 25, 1652, 405, 360]"
เส้นทางนักเขียน “บุพเพสันนิวาส” ของรอมแพง ในวันที่ออกมาทำตามความฝัน,/plearn-plearn/เสนทาง-นกเขยน-บพเพสนนวาส-รอมแพง,/plearn-plearn/business/inspiration-and-success-case/เสนทาง-นกเขยน-บพเพสนนวาส-รอมแพง,เส้นทางนักเขียน บุพเพสันนิวาส ของรอมแพง,รอมแพง นักเขียนนวนิยายที่กลายมาเป็นละครชื่อดัง บุพเพสันนิวาส บนเส้นทางนักเขียน 11 ปีที่ไม่ได้โรยด้วยกลีบกุหลาบ,"[295, 819, 1064, 1011, 58, 40, 1583, 1334, 1001, 1599, 740, 563, 436, 445, 128, 966, 319, 42, 23, 736]"
โบนัสหมด ต้องใช้เงินด่วน กู้เงินออนไลน์ ที่ไหนดี,/plearn-plearn/เงนดวน-Krungsri-iFin-กงาย-ผานมอถอ,/plearn-plearn/guru-financial/money-tips/เงนดวน-Krungsri-iFin-กงาย-ผานมอถอ,เงินด่วนออนไลน์ สั่งได้ง่ายๆ ไม่ต้องใช้คนค้ำ | ธนาคารกรุงศรี,สมัครสินเชื่อ กู้เงินออนไลน์ ต้องสินเชื่อ Krungsri iFIN กู้ง่ายผ่านมือถือ ไม่ต้องมีหลักทรัพย์หรือผู้ค้ำประกัน ไม่มีค่าธรรมเนียม ไม่ต้องเดินทาง ดอกเบี้ยต่ำ,"[223, 1393, 1480, 559, 1593, 925, 1031, 655, 798, 143, 837, 884, 1208, 206, 1440, 1405, 91, 1444, 841, 676]"
ครั้งหนึ่งในชีวิตกับการพิชิต 5 ยอดเขาสูงของไทย,/plearn-plearn/ครงหนง-ชวต-พชต-5-ยอดเขาสง-เทยวไทย,/plearn-plearn/lifestyle/eat-travel/ครงหนง-ชวต-พชต-5-ยอดเขาสง-เทยวไทย,ครั้งหนึ่งในชีวิตกับการพิชิต 5 ยอดเขาสูงของไทย,เตรียมฟิตร่างกายให้พร้อมแล้วออกเดินทางไปพิชิต 5 เส้นทางเทรคกิ้งสุดโหดหินของไทย ที่แม้แต่ชาวต่างชาติยังต้องมาให้ได้สักครั้ง,"[403, 613, 549, 895, 787, 1357, 832, 452, 620, 604, 273, 544, 760, 210, 171, 511, 1274, 788, 1553, 1265]"
มือใหม่ขอสินเชื่อบ้าน พร้อมวิธีคำนวณดอกเบี้ย MRR และ MLR,/plearn-plearn/วธคำนวณ-ดอกเบย-เงนก-ซอบาน,/plearn-plearn/guru-financial/financial/วธคำนวณ-ดอกเบย-เงนก-ซอบาน,ขอสินเชื่อบ้านแบบคนรู้จริง พร้อมวิธีคำนวณดอกเบี้ย MRR และ MLR,เรื่องบ้านแบบดอกเบี้ยไม่บาน ด้วยเคล็ดลับการขอสินเชื่อบ้าน พร้อมวิธีคำนวณดอกเบี้ยทั้งแบบ MRR และ MLR เพื่อให้การขอสินเชื่อบ้านเป็นเรื่องสบายๆ สำหรับคุณ,"[1563, 143, 1444, 1593, 206, 847, 621, 146, 559, 885, 17, 125, 1393, 796, 321, 1208, 1284, 572, 787, 491]"
5 ข้อคิดฝากถึงมนุษย์วัยทำงาน จากสาวน้อยที่ถูกมะเร็งคร่าชีวิต,/plearn-plearn/5-ขอคด-สำหรบ-วยทำงาน-โรคมะเรง,/plearn-plearn/business/inspiration-and-success-case/5-ขอคด-สำหรบ-วยทำงาน-โรคมะเรง,5 ข้อคิดฝากถึงวัยทำงาน จากสาวน้อยที่ถูกมะเร็งคร่าชีวิต,ฮอลลี่ บุชเชอร์ สาวน้อยที่ถูกมะเร็งคร่าชีวิต ได้โพสต์ข้อความสุดท้าย ที่กระตุกเตือนใจมนุษย์วัยทำงานทั่วโลก และช่วยให้เราตระหนักว่าชีวิตของเรามีค่ามากแค่ไหน,"[273, 207, 162, 1187, 1626, 308, 1482, 630, 1543, 170, 256, 218, 508, 611, 369, 85, 267, 1512, 293, 1592]"
หนัง 5 เรื่องที่คุณต้องย้อนดู เมื่อรู้สึก “หมดไฟ”,/plearn-plearn/5-หนงด-ทควรด-แรงบนดาลใจ-เมอรสกหมดไฟ,/plearn-plearn/business/inspiration-and-success-case/5-หนงด-ทควรด-แรงบนดาลใจ-เมอรสกหมดไฟ,หนัง 5 เรื่องที่คุณต้องย้อนดู เมื่อรู้สึกหมดไฟ,แนะนำ 5 หนังดีที่ควรดูในช่วงเวลาที่เราหมดไฟ เพื่อช่วยสร้างแรงบันดาลใจและแรงฮึดสู้ในการออกไปทำในสิ่งที่รักกัน,"[1421, 979, 1334, 256, 1623, 110, 861, 386, 1289, 464, 1085, 229, 243, 1017, 1282, 1170, 257, 417, 1251, 296]"
เช็คดวงเดือนมีนาคมปี 2561 ตามวันเกิด โดย Toktak A4,/plearn-plearn/เชคดวง-เดอนมนาคม-2561-ตามวนเกด-ToktakA4,/plearn-plearn/lifestyle/living/เชคดวง-เดอนมนาคม-2561-ตามวนเกด-ToktakA4,เช็คดวงเดือนมีนาคมปี 2561 ตามวันเกิด โดย Toktak A4,เช็คดวงการเงิน การงาน ความรัก สุขภาพ การเสริมดวง เพื่อวางแผนการเงินและชีวิตในเดือนมีนาคม 2561 โดย Toktak A4,"[829, 716, 647, 754, 670, 821, 771, 668, 790, 737, 699, 629, 594, 607, 449, 539, 616, 527, 525, 569]"
การตลาดเจาะใจคนโสด ... ร้านจับคู่สไตล์ญี่ปุ่น,/plearn-plearn/ธรกจ-หาค-คนโสด-สไตลญปน,/plearn-plearn/business/marketing/ธรกจ-หาค-คนโสด-สไตลญปน,การตลาดเจาะใจคนโสด ... ร้านจับคู่สไตล์ญี่ปุ่น,การไปร้านกาแฟครั้งนี้ อาจเปลี่ยนชีวิตให้คุณไม่ต้องโสดหรือเหงาอีกต่อไป,"[719, 378, 281, 9, 1118, 648, 1477, 390, 544, 218, 698, 1034, 550, 975, 480, 656, 851, 1572, 976, 1236]"
วิธีบริหาร Passion ของพนักงานในองค์กรยุคใหม่,/plearn-plearn/วธบรหาร-พนกงาน-องคกร-ยคใหม,/plearn-plearn/business/management/วธบรหาร-พนกงาน-องคกร-ยคใหม,วิธีบริหาร Passion ของพนักงานในองค์กรยุคใหม่,พนักงานในปัจจุบันส่วนมากเป็นคนยุคมิลเลนเนียลมักถูกมองว่ามีความอดทนน้อย เปลี่ยนงานบ่อย หมดไฟง่าย การเติมและรักษา Passion ของพนักงานเป็นเรื่องสำคัญขององค์กร,"[1108, 851, 13, 326, 1544, 293, 868, 335, 3, 930, 1565, 1242, 902, 1161, 34, 1061, 1251, 1128, 1078, 652]"
ใจนึงอยากเที่ยว อีกใจก็อยากเก็บเงิน เลือกอะไรดี,/plearn-plearn/ใชเงน-เทยว-เกบเงน-เลอกอะไรด,/plearn-plearn/guru-financial/money-tips/ใชเงน-เทยว-เกบเงน-เลอกอะไรด,ใจนึงอยากเที่ยว อีกใจก็อยากเก็บเงิน เลือกอะไรดี,เมื่อใจอยากออกเดินทางท่องเที่ยว แต่ก็กำลังอยู่ในวัยเก็บเงินสร้างตัว จะทำอย่างไรดี เราจะจัดการมันอย่างไร,"[74, 920, 1241, 1426, 638, 620, 1008, 93, 451, 1566, 1068, 1517, 322, 642, 884, 1332, 145, 1634, 840, 360]"
5 กฎเหล็กนักช้อป ในยุคที่เงิน ไปไว-มาไว,/plearn-plearn/5-กฎเหลก-บรหารเงน-ชอปออนไลน,/plearn-plearn/lifestyle/shopping/5-กฎเหลก-บรหารเงน-ชอปออนไลน,5 กฏเหล็กนักช้อป ในยุคที่เงินไปไว-มาไว,นักช้อปคนไทยใช้จ่ายออนไลน์กว่า 8 ล้านคน และมีแนวโน้มยอดใช้จ่ายเพิ่มขึ้นเรื่อยๆ ก่อนจะกระทบเงินออมและสร้างหนี้สิน ต้องจัดการด้วย 5 วิธีดักเงิน,"[1302, 1248, 1426, 270, 1406, 29, 1566, 1606, 1216, 1506, 767, 1579, 773, 488, 1023, 566, 45, 1360, 1436, 330]"
ทุกตำแหน่งงานว่าง ล้วนมีเบื้องหลัง: 4 คำถามตอบตัวเอง ก่อนเปลี่ยนงานใหม่,/plearn-plearn/4-คำถาม-สำรวจตวเอง-กอนเปลยนงาน,/plearn-plearn/business/inspiration-and-success-case/4-คำถาม-สำรวจตวเอง-กอนเปลยนงาน,ทุกตำแหน่งงานว่างล้วนมีเบื้องหลัง,หลายคนไม่อยากเปลี่ยนงานแล้วหนีเสือปะจระเข้ ทำให้ต้องหางานใหม่มีประวัติย้ายงานหลายที่ เรามีวิธีการตั้งคำถามกับตัวเอง ก่อนที่จะเปลี่ยนงานใหม่มาเล่าสู่กันฟัง,"[659, 480, 1320, 685, 1368, 1297, 1061, 1148, 1529, 508, 41, 642, 1557, 1366, 64, 1232, 1432, 1622, 218, 856]"
ของมันต้องมี!! ใช้เงินอนาคตเสียดอกเบี้ยเท่าไร,/plearn-plearn/ของมนตองม-เงนอนาคต-เสยดอกเบยเทาไหร,/plearn-plearn/guru-financial/money-tips/ของมนตองม-เงนอนาคต-เสยดอกเบยเทาไหร,ของมันต้องมี!! ใช้เงินอนาคตเสียดอกเบี้ยเท่าไร,ก็ของมันต้องมี กับปัญหาการใช้เงินปัจจุบันเท่าที่มีกับใช้เงินอนาคตด้วยการกู้ยืม นำพามาซึ่งหนี้บัตรเครดิตก้อนโต ได้เวลาคุมดอกเบี้ยเหล่านี้ให้อยู่หมัด,"[720, 820, 665, 1283, 1311, 1462, 621, 175, 1271, 514, 1606, 620, 1408, 1564, 1573, 899, 1549, 17, 1396, 332]"
เที่ยวต่างประเทศสุด unseen แบบไม่ตามเทรนต์ จากเพจเที่ยวเอง,/plearn-plearn/เทยวตางประเทศ-ไมตาม-เทรนด,/plearn-plearn/lifestyle/eat-travel/เทยวตางประเทศ-ไมตาม-เทรนด,เที่ยวต่างประเทศสุด unseen แบบไม่ตามเทรนต์ จากเพจเที่ยวเอง,การเดินทางเที่ยวรอบโลกน่าจะเป็นความฝันอันดับต้น ๆ ที่หลายคนนึกถึง แต่ไปทั้งทีก็อยากพิเศษไม่ซ้ำใคร มีที่ไหนไม่ควรพลาด เพจ “เที่ยวเอง” จะมาแนะนำให้คุณเอง,"[273, 898, 455, 547, 905, 1621, 196, 353, 279, 937, 1557, 714, 980, 451, 642, 712, 121, 1591, 7, 1459]"
เสริมดวงธุรกิจด้วยเลขโทรศัพท์มงคล สร้างยอดขายปัง,/plearn-plearn/เสรมดวง-ธรกจ-เบอรโทรศพท-เลขมงคล,/plearn-plearn/lifestyle/living/เสรมดวง-ธรกจ-เบอรโทรศพท-เลขมงคล,ผู้ประกอบการต้องรู้!! เลือกเลขโทรศัพท์มงคลให้ส่งเสริมกิจการให้เฟื่องฟู,เลขโทรศัพท์มงคล ศาสตร์ของตัวเลขที่มีเรื่องพลังงาน สถิติและความเชื่อ ส่งเสริมธุรกิจให้รุ่งเรือง ยอดขายพุ่งทะลุเป้า อยากรู้ต้องลอง,"[123, 1186, 834, 551, 1158, 986, 1026, 126, 1409, 1503, 717, 743, 157, 651, 481, 360, 371, 764, 1164, 814]"
เที่ยวไม่ต้องพกกล้อง กับเทคนิคถ่ายรูปสวยด้วยสมาร์ทโฟน by Joez19,/plearn-plearn/ถายรปสวย-ดวย-สมารทโฟน-โดย-Joez19,/plearn-plearn/lifestyle/eat-travel/ถายรปสวย-ดวย-สมารทโฟน-โดย-Joez19,เที่ยวไม่ต้องพกกล้อง กับเทคนิคถ่ายรูปสวยด้วยสมาร์ทโฟน,ถ่ายรูปที่เที่ยวสวยด้วยมือถือใครก็ทำได้ จะโพสลง Instagram หรือ Facebook ได้แบบไม่ต้องง้อกล้องตัวใหญ่ กับเทคนิคการถ่ายรูปด้วยสมาร์ทโฟนของ @joez19,"[939, 730, 932, 1233, 1425, 423, 91, 606, 196, 1119, 581, 857, 64, 68, 1274, 822, 1494, 479, 987, 905]"
5 ที่อิงแอบธรรมชาติใกล้กรุง ที่ใคร ๆ ก็อยากควงแฟนเที่ยววาเลนไทน์,/plearn-plearn/5-ทเทยว-ใกลกรง-เทยวกบแฟน-วนวาเลนไทน,/plearn-plearn/lifestyle/eat-travel/5-ทเทยว-ใกลกรง-เทยวกบแฟน-วนวาเลนไทน,5 ที่อิงแอบธรรมชาติใกล้กรุง ที่ใคร ๆ ก็อยากควงแฟนเที่ยว,5 ที่เที่ยวทางธรรมชาติใกล้กรุงเทพ ขับรถไปได้ง่ายๆ ที่ควรค่าแก่การพาแฟนไปเที่ยววาเลนไทน์นี้ เพื่ออัพเกรดความหวาน หรือจะใช้เป็นสถานที่บอกรักก็ยังได้,"[1119, 262, 693, 196, 905, 759, 560, 1459, 628, 808, 769, 279, 455, 353, 1044, 451, 711, 714, 121, 756]"
ตรุษจีน เล็งโอกาสธุรกิจแนวใหม่ เพื่อเอาใจจีนรุ่นใหม่ อย่างไรดี?,/plearn-plearn/chinese-new-year-sme-opportunity,/plearn-plearn/business/marketing/chinese-new-year-sme-opportunity,ตรุษจีน เล็งโอกาสธุรกิจแนวใหม่ เพื่อเอาใจจีนรุ่นใหม่,คนไทยเชื้อสายจีนยุคใหม่ไลฟสไตล์ต่างจากยุคเก่า ร้านค้าจะมัดใจคนกลุ่มนี้ได้อย่างไรในช่วงตรุษจีน,"[251, 615, 293, 625, 1108, 648, 1532, 166, 529, 116, 342, 38, 774, 179, 405, 636, 1639, 83, 1190, 1463]"
5 เมนูเห็นแล้วหิว แต่กินแล้วร่างพัง,/plearn-plearn/5-yummy-foods-bad-for-health,/plearn-plearn/lifestyle/eat-travel/5-yummy-foods-bad-for-health,5 เมนูเห็นแล้วหิว แต่กินแล้วร่างพัง,5 เมนูเด็ดที่แชร์กันมากมายในโลกโซเชียล เห็นแล้วก็อยากตามไปกินเก็บให้ครบ แต่ช้าก่อน ลองมาสำรวจก่อนสิว่าเมนูไหนที่มีแคลอรีสูง ทำให้สบายไม่รู้ตัว,"[172, 200, 1217, 415, 1008, 488, 301, 80, 455, 1250, 1366, 1639, 496, 299, 303, 359, 1369, 1466, 1498, 671]"
ธุรกิจ E-Commerce ที่มีโอกาสปัง! ในปี 2018,/plearn-plearn/2018-ecommerce-business-trends,/plearn-plearn/business/marketing/2018-ecommerce-business-trends,ธุรกิจ E-Commerce ที่มีโอกาสปัง! ในปี 2018,ในยุคที่ธุรกิจ E-Commerce โตแบบก้าวกระโดด เครื่องมือที่ช่วยเพิ่มยอดขายมีมากมาย แต่ประเภทธุรกิจไหนมีแววรุ่งมากที่สุด มาดูกันว่า ในปี 2018 ธุรกิจไหนจะปังสุดๆ,"[381, 126, 417, 21, 247, 1354, 357, 743, 107, 264, 1146, 307, 548, 406, 371, 818, 658, 1604, 691, 1067]"
ฟรีแลนซ์บริหารรายได้อย่างไรให้ชีวิตดี๊ดี,/plearn-plearn/freelance-work-life-balance,/plearn-plearn/lifestyle/living/freelance-work-life-balance,ฟรีแลนซ์บริหารรายได้อย่างไรให้ชีวิตดี๊ดี,รักจะเป็นฟรีแลนซ์ อย่าปล่อยชีวิตให้ชิวไปวัน ๆ แต่เราต้องบริหารจัดการรายได้ของเราให้ดี อย่าปล่อยให้บัญชียุ่งเหยิงซับซ้อนจนแยกรายรับและรายจ่ายไม่ออก,"[52, 1257, 428, 990, 1601, 767, 38, 505, 1237, 718, 288, 775, 987, 1419, 567, 1598, 1623, 603, 1571, 684]"
จีนนำร่องโอนเงินง่าย ด้วยโปรแกรมจดจำใบหน้า,/plearn-plearn/face-scan-payment-cashless,/plearn-plearn/innovation/innovation-sub/face-scan-payment-cashless,จีนนำร่องโอนเงินง่าย ด้วยโปรแกรมจดจำใบหน้า,QR Code หลบไปจีนก้าวล้ำไปอีกขั้นกับสังคม Cashless Society ด้วยระบบโอนเงินง่ายๆ ด้วยโปรแกรมจดจำใบหน้าจะเป็นอย่างไรมาดูกัน,"[219, 922, 1114, 561, 343, 887, 203, 1274, 330, 535, 560, 512, 1069, 1136, 64, 888, 388, 153, 49, 455]"
เส้นทางชีวิตสุดขั้วของอดีตสาววิศวะจุฬา เมื่อเลือกเบนเข็มอาชีพด้วยการเป็น Extreme Traveler เต็มตัว,/plearn-plearn/life-as-extreme-traveler,/plearn-plearn/lifestyle/eat-travel/life-as-extreme-traveler,เส้นทางชีวิตสุดขั้วของอดีตสาววิศวะจุฬา | Plearn เพลิน,บทสัมภาษณ์สาววิศวะจุฬาสู่ Extreme Traveler ที่มาที่ไปจากการใช้ชีวิตปกติทั่วไป เบนเข็มสู่เส้นทางท่องเที่ยวสุดขั้ว,"[1322, 853, 1371, 858, 824, 736, 1274, 1181, 169, 992, 1203, 273, 1542, 740, 1240, 242, 264, 797, 2, 620]"
