NodeName,DocumentUrlPath,NodeAliasPath,DocumentPageTitle,DocumentPageDescription,recommend
หยอดเงินใส่กระปุก วิธีนี้ยังใช้ได้อยู่ไหม,/plearn-plearn/money-box-saving-does-it-work,/plearn-plearn/guru-financial/financial/money-box-saving-does-it-work,หยอดเงินใส่กระปุก วิธีนี้ยังใช้ได้อยู่ไหม,หมั่นออมเงินเป็นประจำอย่างต่อเนื่อง ช่วยสร้างคุณค่าให้กับตัวเอง เป็นวิธีง่ายและสะดวก ไม่ต้องเดินทางไปฝากเงิน,"[1617, 1328, 1506, 614, 1133, 566, 504, 1353, 896, 1482, 1426, 1566, 514, 1360, 1147, 1633, 993, 1436, 1391, 1394]"
5 วิธีสลัดเรื่องกลุ้มใจ ไม่ต้องพึ่งยา,/plearn-plearn/5-ways-to-get-rid-of-anxiety-without-medication,/plearn-plearn/lifestyle/living/5-ways-to-get-rid-of-anxiety-without-medication,5 วิธีสลัดเรื่องกลุ้มใจ ไม่ต้องพึ่งยา,ปัญหาที่ผ่านเข้ามาในชีวิตเหมือนลมที่ผ่านมาเดี๋ยวมันก็จะผ่านพ้นไป สลัดเรื่องกลุ้มใจแบบไม่ต้องพึ่งยานอนหลับ,"[438, 291, 48, 574, 74, 388, 295, 1443, 107, 1554, 1606, 77, 348, 1369, 381, 437, 1636, 264, 1500, 1234]"
[อยากรวยห้ามพลาด] บริหารต้นทุนแบบมือโปร,/plearn-plearn/tips-to-manage-your-business-expenses,/plearn-plearn/business/management/tips-to-manage-your-business-expenses,[อยากรวยห้ามพลาด] บริหารต้นทุนแบบมือโปร,การลดต้นทุนเป็นสิ่งสำคัญต่อธุรกิจ แต่อย่าลืมว่า คุณภาพสินค้าและบริการยังคงสำคัญที่สุด,"[1521, 287, 1401, 1159, 735, 362, 1336, 1215, 1405, 656, 1112, 1501, 1447, 557, 1552, 978, 476, 296, 1201, 292]"
เมื่อแผนเอไม่เวิร์ก เราจะวางแผนบีอย่างไรดี,/plearn-plearn/plan-a-plan-b-how-it-works,/plearn-plearn/business/inspiration-and-success-case/plan-a-plan-b-how-it-works,เมื่อแผนเอไม่เวิร์ก เราจะวางแผนบีอย่างไรดี,ถอยออกมาจากจุดเดิม เพื่อมองให้เห็นภาพที่กว้างกว่าเดิม วันนี้เรามีเคล็ดลับดี ๆ มาฝากกันค่ะ,"[1579, 1478, 1253, 161, 302, 311, 41, 501, 1161, 84, 43, 162, 46, 739, 34, 1651, 24, 168, 126, 849]"
ปัจจัยสำคัญที่ทำให้ลูกค้าผูกพันแบรนด์เรา,/plearn-plearn/factors-affecting-customer-loyalty,/plearn-plearn/business/marketing/factors-affecting-customer-loyalty,ปัจจัยสำคัญที่ทำให้ลูกค้าผูกพันแบรนด์เรา,พัฒนากลุ่มลูกค้าให้ช่วยบอกต่อความรู่สึกดีที่มีต่อแบรนด์ให้คนอื่น ๆ ได้รับรู้ต่อไป,"[540, 320, 529, 1022, 1151, 1219, 1510, 695, 1477, 1269, 1357, 1638, 512, 293, 394, 1521, 915, 489, 1041, 457]"
เริ่มต้นธุรกิจ วางสมดุลฝ่ายตลาดกับฝ่ายขายอย่างไรดี,/plearn-plearn/the-balance-of-power-between-sales-and-marketing,/plearn-plearn/business/management/the-balance-of-power-between-sales-and-marketing,เริ่มต้นธุรกิจ วางสมดุลฝ่ายตลาดกับฝ่ายขายอย่างไรดี,การเริ่มต้นธุรกิจ จงอย่าลืมเป้าหมายและความฝันที่วาดไว้ วิธีการวางสมดุลนั้นมีหลายวิธี,"[52, 735, 1308, 1223, 1436, 1598, 28, 903, 1636, 509, 145, 1133, 609, 119, 1332, 1613, 1099, 1198, 111, 1009]"
สร้างพอร์ตให้สมดุลด้วยกองทุนอสังหาฯ ต่างประเทศ,/plearn-plearn/how-to-build-a-balanced-investment-portfolio,/plearn-plearn/guru-financial/investment/how-to-build-a-balanced-investment-portfolio,สร้างพอร์ตให้สมดุลด้วยกองทุนอสังหาฯ ต่างประเทศ,ปัจจุบันที่นักลงทุนนิยมลงทุนมากขึ้น ก็คือ กองทุนอสังหาริมทรัพย์ และ กอง REITs (Real estate investment Trust) ที่ให้ผลตอบแทนที่ค่อนข้างสม่ำเสมอ,"[120, 1652, 25, 1010, 128, 1632, 991, 139, 964, 650, 702, 300, 166, 854, 592, 1365, 1569, 563, 1583, 284]"
3 ทางลัดสู่ความสำเร็จจากเพื่อนร่วมงาน,/plearn-plearn/3-shortcuts-to-success-from-colleagues,/plearn-plearn/business/inspiration-and-success-case/3-shortcuts-to-success-from-colleagues,3 ทางลัดสู่ความสำเร็จจากเพื่อนร่วมงาน,ความช่วยเหลือกัน ความร่วมมือ ความสุข คือเส้นทางลัดสู่ความสำเร็จในวันหน้า,"[1225, 1181, 749, 626, 1358, 341, 153, 1052, 1546, 235, 489, 1134, 220, 1162, 740, 1132, 736, 30, 1532, 1207]"
ใครจะรู้น้ำมันมะกอกช่วยบำรุงขนตาได้?,/plearn-plearn/the-secret-of-olive-oil-for-eyelashes,/plearn-plearn/lifestyle/shopping/the-secret-of-olive-oil-for-eyelashes,ใครจะรู้น้ำมันมะกอกช่วยบำรุงขนตาได้?,วันนี้เรามีเคล็ดลับดีๆ น้ำมันมะกอกถูกใช้เป็นส่วนผสมในเครื่องสำอางของพระนางคลีโอพัตรา,"[1452, 1478, 267, 1418, 201, 1408, 161, 1579, 3, 1199, 143, 853, 378, 168, 979, 624, 723, 305, 128, 146]"
ประกันบ้าน มีประโยชน์กว่าที่คิด,/plearn-plearn/what-are-the-benefits-of-home-insurance,/plearn-plearn/guru-financial/financial/what-are-the-benefits-of-home-insurance,ประกันบ้าน มีประโยชน์กว่าที่คิด,บ้าน ศูนย์รวมจิตใจของคนในครอบครัว จึงเป็นการลงทุนก้อนใหญ่ เป็นสินทรัพย์ที่มีมูลค่าสูงสุด,"[1632, 4, 426, 296, 1212, 356, 300, 125, 1485, 847, 650, 1031, 1155, 1462, 1490, 572, 139, 1241, 884, 132]"
เคล็ดลับการลงทุนในตลาดหุ้น ลดความเสี่ยงให้เหลือน้อยที่สุด!,/plearn-plearn/stock-trading-tips-to-lower-your-risk,/plearn-plearn/guru-financial/investment/stock-trading-tips-to-lower-your-risk,เคล็ดลับการลงทุนตลาดหุ้น ลดความเสี่ยงให้เหลือน้อยที่สุด,ความเสี่ยงเป็นสิ่งที่นักลงทุนทั้งหลายต้องรู้จัก เข้าใจ ทำ และ คุมให้อยู่ เคล็ดลับในการลดความเสี่ยงสำหรับการลงทุนในตลาดหุ้น,"[1632, 964, 991, 1629, 752, 128, 177, 1273, 1054, 300, 1652, 25, 4, 1155, 1399, 215, 460, 1558, 317, 1063]"
IQ และ EQ กุญแจสู่ความสำเร็จในการทำงาน,/plearn-plearn/increasing-your-iq-eq-can-efficiency-in-work,/plearn-plearn/guru-financial/financial/increasing-your-iq-eq-can-efficiency-in-work,เจาะลึกข้อเท็จจริง IQ และ EQ คือกุญแจสู่การความสำเร็จจริงหรือไม่?,ฉลาดอย่างเดียวเพียงพอต่อการประสบความสำเร็จหรือไม่ หรือต้องมีอะไรเพิ่มเติมด้วย เจาะลึกข้อเท็จจริง IQ และ EQ คืออะไร? ช่วยให้ประสบความสำเร็จได้อย่างไร?,"[1623, 1546, 626, 1358, 1532, 1225, 1333, 549, 1134, 891, 661, 1249, 1428, 1326, 1405, 1243, 153, 1475, 1369, 784]"
อายุเท่าไหร่ถึงควรมีที่อยู่อาศัยเป็นของตัวเอง,/plearn-plearn/what-is-the-best-age-to-buy-a-house,/plearn-plearn/guru-financial/investment/what-is-the-best-age-to-buy-a-house,อายุเท่าไหร่ถึงควรมีที่อยู่อาศัยเป็นของตัวเอง,ข้อดีของการเริ่มขอสินเชื่อตั้งแต่อายุน้อยคือมีระยะเวลาผ่อนนาน มีสิทธิ์ได้ดอกเบี้ยต่ำกว่า,"[92, 296, 798, 111, 1444, 143, 1592, 796, 243, 1593, 533, 1433, 214, 1351, 1090, 1608, 589, 621, 17, 1393]"
“เงินออมสำรองฉุกเฉิน” เท่าไหร่ถึงเรียกว่าปลอดภัย,/plearn-plearn/are-your-savings-protected,/plearn-plearn/guru-financial/financial/are-your-savings-protected,เงินออมสำรองฉุกเฉิน เท่าไหร่ถึงเรียกว่าปลอดภัย,เงินออมสำรองฉุกเฉินควรเก็บไว้ที่ที่สามารถถอนเงินออกมาใช้ได้อย่างรวดเร็วและความเสี่ยงต่ำ,"[1351, 1083, 1180, 344, 248, 1357, 1328, 1248, 45, 1305, 1399, 1426, 1491, 1566, 1094, 322, 1422, 896, 1644, 1265]"
การทำงานเชิงรุก Proactive ได้ผลในสถานการณ์ใดบ้าง,/plearn-plearn/which-case-will-being-proactive-work-in-workplace,/plearn-plearn/business/inspiration-and-success-case/which-case-will-being-proactive-work-in-workplace,การทำงานเชิงรุก Proactive ได้ผลในสถานการณ์ใดบ้าง,Proactive ชอบคิด ชอบวางแผน จัดการและเตรียมการทุกอย่าง พร้อมแก้ปัญหาและทำงานอย่างมีคุณภาพเพื่ออนาคต,"[1297, 403, 198, 755, 141, 666, 574, 1409, 1598, 390, 1171, 1539, 1258, 731, 1009, 1346, 1126, 1250, 392, 832]"
เอกสารที่ต้องเตรียมก่อนค้ำประกัน,/plearn-plearn/documents-needed-for-a-guarantor-loan,/plearn-plearn/business/management/documents-needed-for-a-guarantor-lo,เอกสารที่ต้องเตรียมก่อนค้ำประกัน,พิจารณาสักนิดว่าเงินที่กู้นั้นจะถูกใช้ในการสร้างผลกำไรกลับมาคุ้มค่าจริงๆ เอกสารที่ต้องเตรียมก่อนค้ำประกัน,"[1498, 787, 1593, 336, 671, 491, 359, 676, 1106, 1410, 726, 832, 82, 223, 174, 1502, 1021, 584, 1441, 1480]"
6 เหตุผลที่เราควรมองบ้านหลังแรกเป็นการลงทุน,/plearn-plearn/buying-your-first-home-a-sign-y,/plearn-plearn/guru-financial/investment/buying-your-first-home-a-sign-y,6 เหตุผลที่เราควรมองบ้านหลังแรกเป็นการลงทุน,บ้านและที่ดินมีมูลค่าเพิ่มขึ้นตามอัตราเงินเฟ้อ มีโอกาสที่มูลค่าจะสูงขึ้นหลายเท่าในอนาคต,"[1205, 1228, 191, 1500, 1501, 1031, 1195, 44, 1444, 1278, 617, 1590, 146, 1302, 1625, 93, 1588, 55, 1077, 1528]"
หาเงินแต่งห้องใหม่ ไม่ให้บานปลาย วัยเรียนก็ทำได้ง่าย ๆ,/plearn-plearn/best-money-saving-decorating-ideas-for-your-home,/plearn-plearn/guru-financial/financial/best-money-saving-decorating-ideas-for-your-home,หาเงินแต่งห้องใหม่ ไม่ให้บานปลาย วัยเรียนก็ทำได้ง่าย ๆ,วัยรุ่นขี้เบื่อใคร ๆ ก็รู้ แต่การจะขอเงินพ่อแม่ใช้ๆปกับเรื่องสิ้นเปลืองก็ใช่เรื่อง,"[303, 181, 190, 80, 1608, 1118, 451, 135, 1464, 1565, 938, 1556, 1587, 1317, 155, 106, 1592, 1648, 624, 1366]"
8 ไอเทมเริ่ด ๆ กินแล้วไม่อ้วน,/plearn-plearn/8-low-calories-items,/plearn-plearn/lifestyle/shopping/8-low-calories-items,8 ไอเทมเริ่ด ๆ กินแล้วไม่อ้วน | Plearn เพลิน,เมื่อกินตามใจปากไม่ได้ ก็ต้องเลือกสิ่งที่กินได้ตลอดที่ท้องร้อง แต่ไม่ทำให้อ้วนแน่นอน,"[200, 1352, 1374, 50, 437, 849, 1239, 275, 813, 666, 1431, 1324, 169, 1482, 1364, 1470, 477, 642, 531, 697]"
เปลี่ยนเจ้านายเป็นหัวหน้าโดยวิธีละมุนละม่อม,/plearn-plearn/stop-being-bossy,/plearn-plearn/business/inspiration-and-success-case/stop-being-bossy,เปลี่ยนเจ้านายเป็นหัวหน้าโดยวิธีละมุนละม่อม,สิ่งที่สำคัญที่สุดในการทำงาน คือ การทำหน้าที่ที่ได้รับมอบหมายในงานของเราให้ดีที่สุด,"[326, 1148, 659, 1078, 1241, 1297, 1320, 1552, 464, 403, 1401, 1242, 1048, 1622, 1061, 128, 362, 287, 243, 856]"
กองทุนแบบไหนตอบโจทย์มนุษย์เงินเดือน,/plearn-plearn/how-to-choose-fund-salary-man,/plearn-plearn/guru-financial/investment/how-to-choose-fund-salary-man,กองทุนแบบไหนตอบโจทย์มนุษย์เงินเดือน,มนุษย์เงินเดือนเมื่อถึงวัยเกษียณมีแนวโน้มเสี่ยงปัญหารายได้และค่าใช้จ่าย “การลงทุน” จึงเป็นสิ่งจำเป็น,"[1456, 1237, 1305, 703, 174, 1054, 1620, 106, 1206, 752, 1413, 430, 557, 1044, 1543, 1632, 767, 1386, 254, 1583]"
เรียงลำดับ 3 สิ่งสำคัญเมื่อเริ่มกิจการของตนเอง,/plearn-plearn/3-important-keys-before-starting-a-business,/plearn-plearn/business/management/3-important-keys-before-starting-a-business,เรียงลำดับ 3 สิ่งสำคัญเมื่อเริ่มกิจการของตนเอง,สำรวจดูก่อนว่าคุณพร้อมสำหรับการทำธุรกิจส่วนตัวแล้วหรือยัง? ด้วยปัจจัยหลายอย่างเหล่านี้ ทำให้หลายคนเริ่มหันมาทำ “ธุรกิจส่วนตัว” กันมากขึ้น,"[1332, 1053, 403, 247, 406, 337, 529, 126, 1128, 787, 1604, 1061, 966, 656, 367, 1529, 21, 427, 608, 1639]"
ซื้อของเดือนละครั้ง เทคนิคช็อปปิ้งในซูเปอร์มาร์เก็ต,/plearn-plearn/once-a-month-shopping-tips-and-trick,/plearn-plearn/lifestyle/shopping/once-a-month-shopping-tips-and-trick,ซื้อของเดือนละครั้ง เทคนิคช็อปปิ้งในซูเปอร์มาร์เก็ต,ยุคอินเทอร์เน็ต กดคลิกเช็คโปรโมชั่นเด็ดทุกห้างเพื่อเทียบราคาก่อน จะได้ของที่ใช่ในราคาสุดคุ้มค่า,"[877, 545, 1042, 953, 362, 399, 1310, 857, 588, 138, 1164, 1051, 1106, 361, 359, 174, 833, 578, 859, 1154]"
แฟชั่นรันเวย์สอนให้คุณเรียนรู้จากความผิดพลาดอย่างไร,/plearn-plearn/what-you-can-learn-from-fashion-runway-mistakes,/plearn-plearn/lifestyle/shopping/what-you-can-learn-from-fashion-runway-mistakes,แฟชั่นรันเวย์สอนให้คุณเรียนรู้จากความผิดพลาดอย่างไร,บนรันเวย์สอนให้ผู้หญิงมีพลัง เริ่มที่ความมั่นใจภายใน ที่ต่อให้เจออุปสรรคก็ต้องไม่รู้สึกพลาด และเดินเชิดหน้าได้ต่อไป,"[1040, 294, 1139, 1200, 1289, 450, 98, 1267, 704, 1117, 1223, 295, 1428, 1477, 315, 1503, 1163, 268, 918, 64]"
แปลกใจไหม ทำไมบ้านเก่าราคาแพงกว่าบ้านใหม่,/plearn-plearn/old-or-new-home-which-offer,/plearn-plearn/guru-financial/investment/old-or-new-home-which-offer,แปลกใจไหม ทำไมบ้านเก่าราคาแพงกว่าบ้านใหม่,บ้านเก่าบางหลังอยู่ในทำเลดี ราคาจะแพงมากและแพงกว่าบ้านใหม่ เพราะอยู่ในโซนที่ไม่สามารถ “ทำซ้ำ” ใหม่ได้,"[1575, 859, 146, 680, 953, 1228, 112, 103, 1585, 1528, 572, 559, 779, 1001, 1284, 1634, 1310, 284, 1131, 125]"
ชีวิตจริงมนุษย์ฟรีแลนซ์ อาชีพนี้เหมาะกับคุณหรือไม่,/plearn-plearn/check-list-if-you-are-suitable-to-be-a-freelancer,/plearn-plearn/business/inspiration-and-success-case/check-list-if-you-are-suitable-to-be-a-freelancer,ชีวิตจริงมนุษย์ฟรีแลนซ์ อาชีพนี้เหมาะกับคุณหรือไม่,หลายคนอยากเป็นฟรีแลนซ์เพราะคิดว่างานสบาย แต่เผลอๆ ฟรีแลนซ์อาจทำงานหนักกว่าพนักงานประจำเสียด้วยซ้ำ,"[1304, 92, 1368, 558, 1380, 772, 1078, 159, 387, 856, 851, 1242, 1482, 1392, 1612, 983, 1187, 1622, 806, 1429]"
ควักเงินซื้อบ้านเป็นการลงทุนจริงหรือ? แล้วควรลงทุนระยะสั้นหรือยาวดี?,/plearn-plearn/short-term-or-long-term-real-estate-investing,/plearn-plearn/guru-financial/investment/short-term-or-long-term-real-estate-investing,ควักเงินซื้อบ้านเป็นการลงทุนจริงหรือ?,การลงทุนบ้านต่างกับการซื้อบ้านพักอาศัย เพราะการลงทุนบ้านทำให้มีกระแสเงินสดเข้า ส่วนบ้านพักอาศัยทำให้กระแสเงินสดออก,"[1528, 146, 206, 1563, 1025, 270, 1126, 787, 1585, 1467, 1228, 1229, 1433, 1377, 1301, 1481, 1415, 1558, 798, 65]"
5 วิธีตั้งเป้าหมายชีวิตให้ประสบความสำเร็จได้จริง,/plearn-plearn/5-secrets-to-accomplish-your-goal,/plearn-plearn/business/inspiration-and-success-case/5-secrets-to-accomplish-your-goal,5 วิธีตั้งเป้าหมายชีวิตแล้วมุ่งมั่นไปให้ถึงฝันอย่างได้ผลจริง,อยากรู้ต้องอ่าน! 5 วิธีตั้งเป้าหมายในชีวิต แล้วไปให้ถึงเป้าหมายที่วางเอาไว้ เป็นหนึ่งในการพัฒนาตัวเองให้มีความมุ่งมั่นและไม่ย่อท้อต่ออุปสรรค จนสำเร็จดังที่ตั้งใจ,"[1099, 1068, 28, 912, 450, 145, 1366, 509, 56, 344, 129, 467, 1260, 484, 1274, 1201, 301, 1113, 1623, 642]"
พลิกวิกฤติให้เป็นโอกาส เปลี่ยนบ้านให้กลายเป็นเงิน,/plearn-plearn/tips-for-home-loans,/plearn-plearn/guru-financial/investment/tips-for-home-loans,พลิกวิกฤติให้เป็นโอกาส เปลี่ยนบ้านให้กลายเป็นเงิน,บ้านที่อยู่อาศัยหรืออาคารพาณิชย์ที่ทำกิจการ สามารถผันมาเป็นเงินสดเพื่อเป็นตัวช่วยในยามคับขัน,"[1440, 1222, 1043, 1415, 270, 92, 1549, 1339, 901, 593, 971, 1640, 502, 946, 787, 1602, 1409, 832, 415, 543]"
ข้อดีของการเริ่มทำธุรกิจตั้งแต่เด็ก,/plearn-plearn/advantages-of-starting-a-business-with-young-age,/plearn-plearn/guru-financial/money-tips/advantages-of-starting-a-business-with-young-age,ข้อดีของการเริ่มทำธุรกิจตั้งแต่เด็ก,การประสบความสำเร็จเริ่มจาก “ไอเดีย ความสามารถ และความกล้าที่จะลุย,"[1546, 891, 626, 1134, 1475, 1281, 1358, 1006, 1623, 1532, 1405, 1207, 1249, 153, 661, 1203, 1607, 489, 1333, 1428]"
เก็บเงินแบบที่เราสบายใจ หรือลองทำอะไรใหม่ ๆ ดี,/plearn-plearn/secrets-saving-for-the-future-while-enjoying-life,/plearn-plearn/guru-financial/money-tips/secrets-saving-for-the-future-while-enjoying-life,เก็บเงินแบบที่เราสบายใจ หรือลองทำอะไรใหม่ ๆ ดี,ใครสักคนบอกให้ออมเงิน 20% ของรายได้ทุกเดือน แต่จะดีกว่าไหมถ้าจะลองทำอะไรใหม่ ๆ เพื่อให้ 20% นี้ผลิดอกออกผลในอนาคต,"[592, 1426, 1432, 572, 293, 1357, 566, 1417, 1577, 1174, 64, 1258, 375, 181, 1506, 144, 129, 175, 156, 371]"
รู้ไว้ไม่ Out! ที่เที่ยวสุดชิค บรรยากาศดี๊ดีของคนกรุง,/plearn-plearn/cool-places-to-visit-in-bangkok,/plearn-plearn/lifestyle/eat-travel/cool-places-to-visit-in-bangkok,รู้ไว้ไม่ Out! ที่เที่ยวสุดชิค บรรยากาศดี๊ดีของคนกรุง,มองหาที่เที่ยวพักสมองบรรยากาศดี ๆ ชิค ๆ ในกรุงเทพฯ ช่วยชาร์จพลังให้ตัวเอง ที่มีให้เลือกชิลได้หลากหลายอารมณ์,"[1289, 140, 1123, 357, 1633, 1267, 1095, 30, 139, 782, 808, 235, 1188, 759, 1001, 642, 1244, 898, 128, 98]"
