NodeName,DocumentUrlPath,NodeAliasPath,DocumentPageTitle,DocumentPageDescription,recommend
4 เทคโนโลยีจากอนาคต ที่ภาคธุรกิจต้องห้ามพลาด,/plearn-plearn/new-innovation-technology-business,/plearn-plearn/innovation/innovation-sub/new-innovation-technology-business,4 เทคโนโลยีจากอนาคต ที่ภาคธุรกิจต้องห้ามพลาด,รวมเทคโนโลยีใหม่ ๆ ในอนาคตที่ภาคธุรกิจห้ามพลาด เพื่อเป็นข้อมูลให้กับภาคธุรกิจและบุคคลทั่วไปเตรียมพร้อมรับมือกับการเปลี่ยนแปลงอนาคต มีอะไรบ้าง อ่านเลย,"[832, 1447, 178, 568, 840, 666, 232, 323, 483, 403, 144, 417, 261, 396, 182, 381, 288, 359, 337, 187]"
Voice search เทรนด์ที่ต้องจับตาในแวดวง E-commerce,/plearn-plearn/voice-search-trending,/plearn-plearn/innovation/innovation-sub/voice-search-trending,Voice search เทรนด์ที่ต้องจับตาในแวดวง E-commerce,พิมพ์เฉยๆ มันธรรมดาไป เดี๋ยวนี้ต้องสั่งงานด้วยเสียง “Voice Search” เทรนด์เทคโนโลยีที่จะเปลี่ยนแปลงวงการ E-commerce อยากได้อะไร…พูดสิ เข้าใจเลย!,"[586, 411, 1432, 150, 240, 193, 76, 117, 1274, 225, 211, 100, 176, 133, 156, 1369, 840, 23, 658, 512]"
แบรนด์กับประเด็นความหลากหลายที่คนทำธุรกิจควรรู้,/plearn-plearn/brand-diversity,/plearn-plearn/business/marketing/brand-diversity,แบรนด์กับประเด็นความหลากหลายที่คนทำธุรกิจควรรู้,แบรนด์กับประเด็นความหลากหลายในสังคมเป็นการเคลื่อนไหวหนึ่งที่คนทำธุรกิจต้องเปิดใจและเปิดรับไอเดียใหม่ ๆ เพื่อตอบโจทย์ลูกค้าให้ดียิ่งขึ้น,"[320, 268, 1439, 427, 287, 1120, 520, 1400, 1200, 333, 222, 187, 1006, 1474, 529, 955, 1536, 1092, 140, 1537]"
ผลกระทบของโรคระบาดโควิด-19 ต่อเศรษฐกิจไทย,/plearn-plearn/economic-covid-impact,/plearn-plearn/guru-financial/financial/economic-covid-impact,ผลกระทบของโรคระบาดโควิด-19 ต่อเศรษฐกิจไทย,วิจัยกรุงศรีเรื่องผลกระทบของโรคระบาดโควิด-19 ต่อเศรษฐกิจไทย โดยดร.สมประวิณ  มันประเสริฐ,"[401, 260, 382, 384, 201, 351, 396, 189, 412, 95, 196, 164, 179, 232, 712, 364, 916, 1447, 159, 310]"
SME ควรจะปรับตัวอย่างไร หลังผ่าน COVID-19,/plearn-plearn/sme-after-covid,/plearn-plearn/guru-financial/financial/sme-after-covid,SME ควรจะปรับตัวอย่างไร หลังผ่าน COVID-19,ภายหลังสถานการณ์การแพร่ระบาดของไวรัสโควิด19 และผลกระทบที่เกิดขึ้นต่อระบบเศรษฐกิจจะทำให้ธุรกิจ SME เปลี่ยนไปอย่างไร และนักธุรกิจควรปรับตัวเพื่อรับมือกับความเปลี่ยนแปลงนี่อย่างไร,"[412, 323, 414, 419, 189, 364, 415, 382, 410, 78, 401, 330, 260, 384, 201, 785, 163, 310, 179, 1405]"
รวมวิธีใช้จ่ายอย่างชาญฉลาด ตามหลักพอเพียง,/plearn-plearn/sufficiency-spending,/plearn-plearn/guru-financial/money-tips/sufficiency-spending,รวมวิธีใช้จ่ายอย่างชาญฉลาด ตามหลักพอเพียง,ด้วยสถานการณ์ที่เกิดขึ้น ทำเศรษฐกิจในตอนนี้กำลังชะลอตัวลง การจับจ่ายใช้สอยในชีวิตประจำวันก็อาจจะต้องมีการปรับตัว,"[61, 349, 1185, 1317, 396, 139, 62, 235, 93, 466, 323, 505, 249, 1519, 417, 1150, 318, 503, 785, 1262]"
PENGUIN IN THE COVID-19 WAR โอกาสที่ได้มาจากวิกฤต,/plearn-plearn/penguin-shabu-in-covid-19,/plearn-plearn/business/inspiration-and-success-case/penguin-shabu-in-covid-19,PENGUIN IN THE COVID-19 WAR  โอกาสที่ได้มาจากวิกฤต,มารู้จักกับเจ้าของร้านบุพเฟ่ต์ Penguin Shabu ที่มาพร้อมกับแนวคิดวิธีการรับมือของช่วงสถานการณ์ที่ทุกธุรกิจต่างก็ต้องปรับตัว,"[323, 1578, 832, 396, 381, 247, 60, 502, 417, 135, 1148, 760, 858, 415, 1303, 728, 1506, 403, 349, 379]"
HOW TO ช้อปของเข้าบ้านยังไง ให้ถูกและดี,/plearn-plearn/how-to-shopping-save-and-good,/plearn-plearn/lifestyle/shopping/how-to-shopping-save-and-good,HOW TO ช้อปของเข้าบ้านยังไง ให้ถูกและดี,เศรษฐกิจปัจจุบันค่อนข้างจะซบเซา ข้าวของก็ราคาสูงขึ้นสวนทางกับรายได้ การช้อปปิ้งของเข้าบ้าน อย่างนี้ควรทำอย่างไรดีเพื่อให้คุ้มค่ากับเงินที่จะเสียไปมากที่สุด,"[931, 1190, 857, 451, 878, 362, 1601, 396, 330, 121, 360, 854, 21, 830, 642, 638, 1008, 1241, 564, 1106]"
ดวง 12 ราศี ประจำเดือนมิถุนายน 2563 โดยอาจารย์เกียว จันทร์วิมล,/plearn-plearn/เชคดวง-มถนายน-2563,/plearn-plearn/lifestyle/living/เชคดวง-มถนายน-2563,ดวง 12 ราศี ประจำเดือนมิถุนายน 2563 โดยอาจารย์เกียว จันทร์วิมล,เช็คดวงการเงิน การงาน ความรัก สุขภาพ การเสริมดวง เพื่อวางแผนการเงินและชีวิตประจำเดือนมิถุนายน 2563 โดย อาจารย์เกียว จันทร์วิมล ศรีสันติสุข,"[474, 366, 449, 463, 324, 289, 435, 420, 314, 383, 569, 527, 345, 475, 754, 607, 594, 539, 616, 525]"
ผลกระทบของ Covid-19 ต่อเศรษฐกิจไทย และคนทำธุรกิจ SME,/plearn-plearn/covid19-newnormal-with-sme,/plearn-plearn/guru-financial/financial/covid19-newnormal-with-sme,ผลกระทบของ Covid-19 ต่อเศรษฐกิจไทย และคนทำธุรกิจ SME,สถารการณ์โควิด-19ส่งผลกระทบอย่างไรบ้างต่อเศรษฐกิจไทย SME และผู้ประกอบการ อ่านบทวิเคราห์ได้จากูรูทางการเงิน ดร.สมประวิณ มันประเสริฐ,"[395, 384, 412, 396, 310, 95, 189, 1542, 179, 1553, 1447, 835, 712, 364, 1382, 1571, 260, 227, 376, 78]"
เตรียมตัวยังไงดี? เมื่อคิดจะเลี้ยงสัตว์ในบ้าน,/plearn-plearn/pet-owner,/plearn-plearn/lifestyle/living/pet-owner,เตรียมตัวยังไงดี? เมื่อคิดจะเลี้ยงสัตว์ในบ้าน,การเลี้ยงสัตว์ถือเป็นเรื่องที่ไม่ง่ายเลย เพราะเมื่อตัดสินใจเลี้ยงก็ต้องดูแลให้ดีเหมือนคนในครอบครัว เรามีวิธีเตรียมตัวสำหรับมือใหม่ที่อยากเลี้ยงสัตว์มาฝากกัน,"[928, 204, 500, 329, 443, 168, 1111, 755, 255, 1241, 642, 664, 165, 1129, 1253, 1377, 703, 1236, 1400, 1555]"
อยาก “ลาออก” จากมนุษย์เงินเดือน มาทำธุรกิจส่วนตัว ต้องเตรียมตัวอย่างไร,/plearn-plearn/salaryman-to-business-owner,/plearn-plearn/guru-financial/money-tips/salaryman-to-business-owner,อยาก “ลาออก” จากมนุษย์เงินเดือน มาทำธุรกิจส่วนตัว ต้องเตรียมตัวอย่างไร,หากคุณกำลังคิดอยากลาออกจากงานเพื่อมาทำธุรกิจส่วนตัว สิ่งสำคัญที่สุดคือการวางแผน และเตรียมพร้อมอย่างดี แล้วต้องเตรียมพร้อมในเรื่องใดบ้างมาลองศึกษาไปพร้อมกัน,"[787, 511, 141, 832, 755, 1210, 1217, 789, 243, 501, 1061, 936, 1552, 1215, 760, 1636, 574, 1103, 1651, 24]"
5 ต้นไม้มงคลช่วยฟอกอากาศ ดีต่อกาย ดีต่อใจ,/plearn-plearn/tree-air-purification,/plearn-plearn/lifestyle/living/5-ตนไมมงคลชวยฟอกอากาศ-ดตอกาย-ดตอใจ,5 ต้นไม้มงคลช่วยฟอกอากาศ ดีต่อกาย ดีต่อใจ,รวมต้นไม้มงคลสำหรับปลูกไว้ในบ้าน ที่นอกจากจะช่วยเสริมดวงแล้วยังสามารถช่วยฟอกอากาศในบ้านให้อากาศดีอยู่ตลอด อยากรู้ว่ามีต้นไม้อะไรบ้างไปอ่านกันเลย,"[180, 600, 1, 206, 146, 101, 1528, 310, 608, 45, 459, 112, 467, 1563, 834, 329, 1183, 1220, 259, 1640]"
แบบสำรวจความฝัน “อาชีพอะไรที่เด็กมัธยมต้นในญี่ปุ่นอยากเป็น”,/plearn-plearn/occupation-in-dream-japansalaryman,/plearn-plearn/lifestyle/living/occupation-in-dream-japansalaryman,แบบสำรวจความฝัน“อาชีพอะไรที่เด็กมัธยมต้นในญี่ปุ่นอยากเป็น”,ความฝันของเด็กมัธยมในญี่ปุ่น  อาชีพอะไรที่อยากเป็น  เด็กญี่ปุ่นจะมีความคิดเหมือนหรือต่างจากเด็กไทยยุคใหม่หรือไม่ แล้วผู้ปกครองควรส่งเสริมลูก ๆ อย่างไร,"[1551, 202, 1505, 99, 628, 1430, 835, 1570, 364, 35, 171, 510, 1639, 1523, 977, 262, 8, 480, 760, 157]"
เช็กลิสต์ข้อต้องรู้ก่อนจะเริ่มขายอาหารออนไลน์,/plearn-plearn/food-online-shop,/plearn-plearn/business/marketing/food-online-shop,เช็กลิสต์ข้อต้องรู้ก่อนจะเริ่มขายอาหารออนไลน์,กระแสธุรกิจขายอาหารออนไลน์ช่วงนี้มาแรงสุด ๆ หลายคนมองหาช่องทางในการทำธุรกิจอาหารออนไลน์ ลองมาดูเช็กลิสต์ข้อต้องรู้ก่อนเปิดธุรกิจนี้กัน,"[144, 371, 126, 691, 21, 337, 1217, 124, 417, 818, 161, 606, 232, 814, 367, 502, 107, 80, 1259, 381]"
BRANDING STORY นักทำลายขยะที่ชื่อว่า “Rubber Killer”,/plearn-plearn/rubber-killer,/plearn-plearn/business/inspiration-and-success-case/rubber-killer,BRANDING STORY นักทำลายขยะที่ชื่อว่า Rubber Killer,มารู้จักกับ Rubber killer และการรับมือวิกฤตการณ์ความรับผิดชอบต่อสิ่งแวดล้อมในฐานะมนุษย์และในฐานะแบรนด์,"[1605, 1489, 430, 637, 1486, 1420, 689, 304, 1384, 320, 1576, 910, 740, 1389, 432, 1200, 257, 1206, 429, 1528]"
มารู้จักกับกองทุน SSF และ SSF พิเศษ กองทุนที่มาทดแทน LTF,/plearn-plearn/ssf-ssfx,/plearn-plearn/guru-financial/financial/ssf-ssfx,มารู้จักกับกองทุน SSF และ SSF พิเศษ กองทุนที่มาทดแทน LTF,กองทุนใหม่ตัวช่วยในการลดหย่อนภาษีมาแนะนำให้ได้รู้จักกัน นั่นก็คือกองทุน SSF และ SSF Extra กองทุนเพื่อการออม เข้ามาอ่านรายละเอียดเพิ่มเติมได้ที่นี่เลย,"[292, 422, 365, 650, 1027, 165, 139, 612, 1373, 702, 1390, 241, 166, 1010, 369, 370, 306, 1355, 1012, 300]"
วางแผนเก็บค่าเทอมเพื่อลูก สำหรับพ่อแม่ยุคใหม่,/plearn-plearn/parents-saving-children-education,/plearn-plearn/guru-financial/plan-your-money/parents-saving-children-education,พ่อแม่ยุคใหม่ วางแผนค่าเรียนลูกอย่างไร ให้การเงินคล่องตัว?,เพื่อให้ลูกมีอนาคตอันสดใส พ่อแม่ยุคใหม่จะวางแผนเก็บค่าเทอมเพื่อลูกอย่างไรดี ให้มีเงินเก็บ แถมทำให้เงินงอกเงย ช่วยแบ่งเบาภาระและไม่กระทบการเงินครอบครัว,"[755, 1428, 198, 578, 1552, 1125, 1509, 500, 772, 270, 334, 1236, 624, 99, 1269, 1183, 134, 79, 111, 174]"
วิธีปรับตัวบนโลกโซเชียลมีเดียในช่วงเวลาวิกฤติ COVID-19,/plearn-plearn/covid-19-situation-junejune,/plearn-plearn/lifestyle/living/covid-19-situation-junejune,วิธีปรับตัวบนโลกโซเชียลมีเดียในช่วงเวลาวิกฤติ COVID-19,ช่วงสถานการณ์การแพร่ระบาดของวัสโควิด-19 ข่าวสารมากมายทั้งข้อเท็จจริงและข้อมูลเท็จทำให้หลายคนเกิดความสับสนจนอาจกลายเป็นความเครียดได้ แล้วจะรับมืออย่างไร,"[396, 382, 419, 414, 364, 189, 415, 323, 286, 429, 119, 413, 1039, 260, 1207, 1335, 997, 201, 252, 489]"
เปิดตำราฟินเทค กุญแจสำคัญในการพลิกวิกฤติธุรกิจ,/plearn-plearn/fintech-business,/plearn-plearn/business/inspiration-and-success-case/fintech-business,เปิดตำราฟินเทค กุญแจสำคัญในการพลิกวิกฤติธุรกิจ,ธุรกิจ fintech คืออะไร และมีความสำคัญอย่างไรต่อวงการธนาคารและวงการธุรกิจ ค้นหาคำตอบนี้ได้กับผู้เชี่ยวชาญเรื่องฟินเทค คุณแซม ตันสกุล หรือ Mr.Fintech,"[502, 263, 876, 412, 186, 1153, 436, 307, 131, 287, 1007, 1557, 1096, 1207, 1624, 197, 656, 1405, 773, 52]"
5 เรื่องที่ SME ต้องคิดเพื่อปรับกลยุทธ์การสื่อสารในช่วง “วิกฤต”,/plearn-plearn/sme-communication-during-crisis,/plearn-plearn/business/marketing/sme-communication-during-crisis,5 เรื่องที่ SME ต้องคิดเพื่อปรับกลยุทธ์การสื่อสารในช่วง “วิกฤต”,ในช่วงเวลาวิกฤตจากการแพร่ระบาดไวรัสโควิด-19 ที่ส่งผลกระทบต่อเศรษฐกิจเช่นนี้ ธุรกิจ SME ต้องปรับตัวอย่างไรบ้าง ค้นหาคำตอบนี้ได้จากคุณรวิศ หาญอุตสาหะ,"[396, 384, 310, 401, 323, 370, 376, 419, 1447, 179, 884, 502, 78, 381, 411, 47, 247, 95, 415, 414]"
เปลี่ยนบ้านเป็นยิม! รวมกิจกรรมเรียกเหงื่อไว้สู้โควิด-19,/plearn-plearn/exercise-at-home,/plearn-plearn/lifestyle/living/exercise-at-home,เปลี่ยนบ้านเป็นยิม! รวมกิจกรรมเรียกเหงื่อไว้สู้โควิด-19,มาดูวิธีการประยุกต์ท่าออกกำลังกายที่ทำได้ง่าย ๆ ที่บ้าน เพื่อเสนิมสร้างภูมิคุ้มกันให้ร่างกายแข็งแรงในช่วงการแพร่ระบาดของไวรัส Covid-19 กันเถอะ,"[415, 414, 419, 331, 588, 448, 201, 1253, 382, 396, 381, 1641, 519, 306, 1065, 260, 132, 1133, 410, 169]"
4 เทคโนโลยีใหม่ที่ต้องจับตาหลังจากโควิด,/plearn-plearn/4-technology,/plearn-plearn/innovation/innovation-sub/4-technology,4 เทคโนโลยีใหม่ที่ต้องจับตาหลังจากโควิด,สถานการณ์การแพร่ระบาดไวรัส Covid- 19 1ทำให้ไลฟ์สไตล์การใช้ชีวิตของผู้คนเปลี่ยนไป และหลังจากนี้จะเกิดเทคโนโลยีใหม่ๆ เพื่อตอบโจทย์ new normal,"[396, 364, 419, 201, 413, 415, 382, 281, 189, 163, 448, 410, 260, 429, 412, 357, 381, 218, 1274, 444]"
5 เมนูเด็ดต้านไวรัส ทำง่าย ๆ แถมประหยัดด้วย,/plearn-plearn/antivirus-food,/plearn-plearn/lifestyle/eat-travel/antivirus-food,5 เมนูเด็ดต้านไวรัส ทำง่าย ๆ แถมประหยัดด้วย,ในช่วงสถานการณ์ที่เราทุกคนยังคงต้องเก็บตัวอยู่ที่บ้านเพื่อช่วยลดการแพร่ระบาดของไวรัสโควิด-19 เรามีเมนูอาหารง่าย ๆ ที่ช่วยมาฝากกัน,"[413, 396, 189, 201, 414, 419, 382, 249, 349, 161, 162, 260, 179, 410, 381, 412, 423, 310, 229, 364]"
ชีวิตในหลุมดำของ ก้อง กันตภณ เมธีกุล,/plearn-plearn/gongkan-artist-inspiration,/plearn-plearn/business/inspiration-and-success-case/gongkan-artist-inspiration,ชีวิตในหลุมดำของ ก้อง กันตภณ เมธีกุล,อัตลักษณ์ในงานของก้องคือป๊อบอาร์ตที่ดูน่าจะสดใส ซึ่งคอนทราสกับจุดกำเนิดของผลงานที่สร้างขึ้นมาจากความเศร้า,"[1320, 1297, 1365, 1061, 1215, 1242, 1289, 1256, 1148, 685, 41, 1078, 961, 1368, 659, 1546, 1450, 144, 684, 508]"
ส่องธุรกิจ ปรับตัวเป็นแล้วปัง ในช่วง Stay at Home,/plearn-plearn/business-covid-19,/plearn-plearn/business/marketing/business-covid-19,ส่องธุรกิจปรับตัวเป็นแล้วปัง ในช่วง Stay at Home,ทุกวิกฤติย่อมมีโอกาสเสมอ มาดูกันว่าจะมีธุรกิจอะไรที่มีการปรับตัวแล้วปังจนมาแรงในช่วงนี้ เผื่อเป็นไอเดียดี ๆ ในการต่อยอดธุรกิจในอนาคตได้อีกด้วย,"[126, 814, 1518, 1409, 1006, 1146, 381, 52, 406, 323, 21, 247, 111, 993, 60, 467, 144, 347, 656, 187]"
อยากเกษียณคูล ๆ ต้องรู้อะไรบ้าง?,/plearn-plearn/financial-plan-retirement,/plearn-plearn/guru-financial/plan-your-money/financial-plan-retirement,อยากเกษียณคูล ๆ ต้องรู้อะไรบ้าง?,อยากมีชีวิตหลังเกษียณอายุแบบคูลๆ หรืออยู่กับบั้นปลายแบบขัดสน? ถ้าอยากมีชีวิตบั้นปลายแบบสุขสบาย ก็ต้องเริ่มเรียนรู้การวางแผนการเงินเพื่อเกษียณและลง,"[1386, 1077, 548, 1607, 703, 1472, 501, 624, 254, 455, 639, 1305, 214, 896, 1636, 297, 390, 236, 1237, 1058]"
แพ็ครวมความรู้ วิธีการแก้ไขปัญหาแบบคนญี่ปุ่นเมื่อเกิด COVID-19,/plearn-plearn/covid-19-japansalaryman,/plearn-plearn/lifestyle/living/covid-19-japansalaryman,แพ็ครวมความรู้ วิธีการแก้ไขปัญหาแบบคนญี่ปุ่นเมื่อเกิด COVID-19,สถานการณ์การแพร่ระบาดของไวรัส Covid-19 หรือไวรัสโคโรนาเป็นอย่างไรบ้างในประเทศญี่ปุ่นแล้วรัฐบาลมีการรับมืออย่างไรบ้าง หาคำตอบนี้ได้ที่นี่กับคุณบูม Japan Salaryman,"[396, 414, 382, 448, 415, 412, 413, 201, 364, 410, 189, 381, 370, 322, 260, 227, 310, 358, 1539, 429]"
ดวง 12 ราศี ประจำเดือนพฤษภาคม 2563 โดยอาจารย์เกียว จันทร์วิมล,/plearn-plearn/เชคดวง-พฤษภาคม-2563,/plearn-plearn/lifestyle/living/เชคดวง-พฤษภาคม-2563,ดวง 12 ราศี ประจำเดือนพฤษภาคม 2563 โดยอาจารย์เกียว จันทร์วิมล,เช็คดวงการเงิน การงาน ความรัก สุขภาพ การเสริมดวง เพื่อวางแผนการเงินและชีวิตประจำเดือนพฤษภาคม 2563 โดย อาจารย์เกียว จันทร์วิมล ศรีสันติสุข,"[474, 366, 449, 580, 463, 324, 289, 400, 435, 314, 383, 345, 475, 771, 607, 539, 594, 527, 616, 525]"
